{
  "$schema": "../../schema/story.schema.json",
  "id": "1967-to-today",
  "title": {
    "en": "1967 to today"
  },
  "summary": {
    "en": "From the June 1967 war through peace treaties, uprisings, the Oslo years and the wars since 2023, with each side’s account."
  },
  "steps": [
    {
      "date": {
        "year": 1967,
        "month": 7
      },
      "view": {
        "center": [
          35.6,
          31.6
        ],
        "zoom": 6.3
      },
      "layers": [
        "territories",
        "places",
        "holy",
        "conflicts",
        "migrations",
        "modern"
      ],
      "title": {
        "en": "June 1967"
      },
      "card": {
        "en": "Between 5 and 10 June 1967 Israel defeated Egypt, Jordan and Syria and occupied the Sinai Peninsula, the Gaza Strip, the West Bank, East Jerusalem and the Golan Heights [1]. Israelis call it the Six-Day War; in Arabic it is called al-Naksa, “the setback” [2][3]."
      },
      "sources": [
        {
          "ref": "us-oh-1967-war",
          "locator": "section 'The War and its Aftermath'",
          "quote": "Between June 5 and June 10, Israel defeated Egypt, Jordan, and Syria and occupied the Sinai Peninsula, the Gaza Strip, the West Bank, East Jerusalem, and the Golan Heights."
        },
        {
          "ref": "palquest-june-1967-war",
          "locator": "highlight text",
          "quote": "Dubbed the Six-Day War by Israelis because in six days they were able to achieve an overwhelming victory over the armed forces of Egypt , Syria , and Jordan"
        },
        {
          "ref": "britannica-six-day-war",
          "locator": "Quick Facts",
          "quote": "Also called: June War or Third Arab-Israeli War or Naksah"
        }
      ],
      "duration_s": 14
    },
    {
      "date": {
        "year": 1967,
        "month": 8
      },
      "view": {
        "center": [
          35.232,
          31.777
        ],
        "zoom": 10.5
      },
      "layers": [
        "territories",
        "places",
        "holy",
        "conflicts",
        "migrations",
        "modern"
      ],
      "highlight": [
        "jerusalem"
      ],
      "title": {
        "en": "Jerusalem"
      },
      "card": {
        "en": "On 27 and 28 June 1967 Israel applied its law, jurisdiction and administration to East Jerusalem and surrounding areas [1][2]. Israel told the UN that “annexation” was the wrong word and that the measures concerned administrative integration; the Palestinian account calls them annexation [3][4]."
      },
      "sources": [
        {
          "ref": "un-s-8146-1967",
          "locator": "para. 39 (PDF/OCR text; quote normalised for OCR, hyphenation and ligature errors)",
          "quote": "Under the Law and Administration Ordinance (Amendment No. 11) Law of 27 June 1967, it was provided that the law, jurisdiction and administration of the State should apply"
        },
        {
          "ref": "un-s-8146-1967",
          "locator": "para. 39 (PDF/OCR text; quote normalised for OCR, hyphenation and ligature errors)",
          "quote": "the Government issued an order dated 28 June 1967 which declared that a territory defined in an annex was an area in which the law, jurisdiction and administration of the State of Israel were in force"
        },
        {
          "ref": "un-s-8052-1967",
          "locator": "Israeli Foreign Minister's reply of 10 July 1967 (PDF/OCR text; quote normalised for OCR, hyphenation and ligature errors)",
          "quote": "The term \"annexation\" used by supporters of the resolution is out of place. The measures adopted relate to the integration of Jerusalem in the administrative and municipal spheres"
        },
        {
          "ref": "palquest-fischbach-jerusalem",
          "locator": "essay",
          "quote": "On 28 June 1967, Israel adopted legislation annexing East Jerusalem and uniting it under the authority of the city administration of West Jerusalem."
        }
      ],
      "duration_s": 14
    },
    {
      "date": {
        "year": 1967,
        "month": 12
      },
      "view": {
        "center": [
          35.6,
          31.6
        ],
        "zoom": 6.3
      },
      "layers": [
        "territories",
        "places",
        "holy",
        "conflicts",
        "migrations",
        "modern"
      ],
      "title": {
        "en": "Resolution 242"
      },
      "card": {
        "en": "In September an Arab summit in Khartoum resolved on “no peace with Israel, no recognition of Israel, no negotiations with it” [1]. In November the UN Security Council unanimously called for the “withdrawal of Israel armed forces from territories occupied in the recent conflict” [2][3]. Whether that means all the territories is disputed: Israeli scholars note that proposals to require a total withdrawal were rejected, while others point to the French text, “des territoires”, “the territories” [4][5]."
      },
      "sources": [
        {
          "ref": "avalon-khartoum",
          "locator": "resolution 3",
          "quote": "no peace with Israel, no recognition of Israel, no negotiations with it, and insistence on the rights of the Palestinian people in their own country."
        },
        {
          "ref": "un-s-res-242-1967",
          "locator": "operative para. 1(i) (PDF/OCR text; quote normalised for OCR, hyphenation and ligature errors)",
          "quote": "Withdrawal of Israel armed forces from territories occupied in the recent conflict"
        },
        {
          "ref": "un-s-res-242-1967",
          "locator": "adoption note (PDF/OCR text; quote normalised for OCR, hyphenation and ligature errors)",
          "quote": "Adopted unanimously at the 1382nd meeting."
        },
        {
          "ref": "blum-boundaries",
          "locator": "section on 1967",
          "quote": "Arab-Soviet attempts to have the resolution demand Israel’s total withdrawal to the former armistice lines were rejected by the resolution’s sponsors"
        },
        {
          "ref": "palquest-fischbach-242",
          "locator": "essay",
          "quote": "Others reject this interpretation, often pointing to the official French version of the resolution, which includes a definite article, referring to withdrawal from “des territoires.”"
        }
      ],
      "duration_s": 14
    },
    {
      "date": {
        "year": 1973,
        "month": 11
      },
      "view": {
        "center": [
          35.6,
          31.6
        ],
        "zoom": 6.3
      },
      "layers": [
        "territories",
        "places",
        "holy",
        "conflicts",
        "migrations",
        "modern"
      ],
      "title": {
        "en": "October 1973"
      },
      "card": {
        "en": "On 6 October 1973, the Jewish Day of Atonement, Egyptian forces crossed the Suez Canal and broke through Israel’s Bar Lev line [1][2]. The UN Security Council called for a ceasefire on 22 October [3]. Israelis call it the Yom Kippur War; it is also known as the October War and the Ramadan War [4]."
      },
      "sources": [
        {
          "ref": "israel-mfa-arab-israeli-wars",
          "locator": "section 'The Yom Kippur War (October 1973)'",
          "quote": "The war was so called because it started on the holiest day in the Jewish calendar, the Day of Atonement (October 6, 1973)."
        },
        {
          "ref": "palquest-october-1973-war",
          "locator": "highlight text",
          "quote": "On the afternoon of 6 October 1973, Egyptian tanks backed by war planes broke through the Bar Lev Line , Israel’s line of fortifications along the eastern edge of the Suez Canal ."
        },
        {
          "ref": "palquest-october-1973-war",
          "locator": "highlight text",
          "quote": "on 22 October 1973, the UN Security Council passed Resolution 338 ."
        },
        {
          "ref": "britannica-yom-kippur-war",
          "locator": "Quick Facts",
          "quote": "Also called the: October War, the Ramadan War, the Arab-Israeli war of October 1973, or the Fourth Arab-Israeli War"
        }
      ],
      "duration_s": 14
    },
    {
      "date": {
        "year": 1974,
        "month": 12
      },
      "view": {
        "center": [
          35.6,
          31.6
        ],
        "zoom": 6.3
      },
      "layers": [
        "territories",
        "places",
        "holy",
        "conflicts",
        "migrations",
        "modern"
      ],
      "title": {
        "en": "The PLO at the UN"
      },
      "card": {
        "en": "In 1974 the Arab states meeting at Rabat recognised the PLO as the “sole legitimate representative of the Palestinian people” [1]. Yasser Arafat told the UN General Assembly that he had come “bearing an olive branch and a freedom-fighter’s gun” [2]. Israel’s representative replied that the PLO sought not the rights of the Palestinians but the annulment of the rights of the Jewish people [3]."
      },
      "sources": [
        {
          "ref": "kinghussein-1988-disengagement",
          "locator": "editorial introduction",
          "quote": "King Hussein agreed with all the other Arab leaders to a declaration recognizing the Palestine Liberation Organization (PLO) as the “sole legitimate representative of the Palestinian people.”"
        },
        {
          "ref": "un-dpr-origins-part2",
          "locator": "Part II, quoting A/PV.2282",
          "quote": "Today I have come bearing an olive branch and a freedom-fighter’s gun. Do not let the olive branch fall from my hand."
        },
        {
          "ref": "un-dpr-origins-part2",
          "locator": "Part II, quoting the Israeli reply (A/PV.2283)",
          "quote": "concerned primarily not with the realization of the rights of the Palestinians, but with the annulment of the rights of the Jewish people."
        }
      ],
      "duration_s": 14
    },
    {
      "date": {
        "year": 1979,
        "month": 4
      },